{
  "id": "gen-retry-with-exponential-backoff-001",
  "type": "pattern",
  "title": "Retry with exponential backoff for flaky API calls",
  "language": "general",
  "tags": ["retry", "backoff", "api", "resilience", "rate-limiting", "networking"],
  "pattern": {
    "problem": "API calls to external services intermittently fail due to rate limits, temporary outages, or network issues. Simple retry loops either fail too fast or waste time with fixed delays.",
    "approach": "Implement exponential backoff with jitter: start with a short delay, double it on each retry, and add random jitter to prevent thundering herd. Cap the maximum delay and total retry count.",
    "example": "import time\nimport random\n\ndef retry_with_backoff(fn, max_retries=5, base_delay=1.0, max_delay=60.0):\n    for attempt in range(max_retries):\n        try:\n            return fn()\n        except (ConnectionError, TimeoutError, RateLimitError) as e:\n            if attempt == max_retries - 1:\n                raise\n            delay = min(base_delay * (2 ** attempt), max_delay)\n            jitter = random.uniform(0, delay * 0.1)\n            time.sleep(delay + jitter)",
    "when_to_use": "Any time you call an external API that might be rate-limited, temporarily unavailable, or experience transient network errors. Especially important for CI/CD pipelines, data pipelines, and background jobs.",
    "when_not_to_use": "Don't use for errors that won't resolve with retries (authentication failures, 404s, validation errors). Don't use for user-facing synchronous requests where you need immediate feedback — show an error instead of making the user wait."
  },
  "solution": {
    "description": "The exponential backoff pattern increases wait time between retries exponentially (1s, 2s, 4s, 8s, ...) with random jitter to avoid synchronized retry storms. Most HTTP client libraries have built-in support: Python's tenacity, JavaScript's axios-retry, Go's backoff package."
  },
  "external_references": [
    {
      "url": "https://aws.amazon.com/blogs/architecture/exponential-backoff-and-jitter/",
      "title": "AWS: Exponential Backoff and Jitter"
    }
  ],
  "metadata": {
    "contributing_agent": "claude-code",
    "confidence": "high",
    "verified": true,
    "verification_count": 8,
    "submitted_at": "2026-02-20T12:00:00Z"
  }
}
